Rating,Description,Pros,Cons,Author Info,Resignation Reason
2.0,Depends on team,- competitive compensation - lots of opportunities to learn- people are generally nice,Very disorganized company culture. WLB is not great but people respect your boundaries when you set them.,"Verified User Current Employee  C*****  Sales - Apr 28, 2022",
4.0,Great place to learn technically,Its great place to learn lot of technical stuffsEveryone is friendly and teach you a lot,One of the main barriers is language for non Chinese speakers but still can manage,"Verified User Current Employee  G*****  Software Engineer - May 6, 2022",
3.0,Good learning opportunities; Bad WLB and culture,- very large work scope. Able to have huge impact as new grad- smart colleagues (lots of ex-FAANG)- great tech stack,"- language barrier is a huge problem (e.g. day to day communication with CN team, Chinese docs)- Most teams have some amount of dependency in CN team. So, night work is unavoidable- Very low diversity- Bad PTO","Verified User Current Employee  I*****  Software Engineer - May 6, 2022",
5.0,Disruptor ,If you like to build and have a start up mentality this is the place for you ,"Start ups are in build mode; policies, processes and tools one may expect from a corporate reality are in the making. Can be difficult and frustrating for some","Verified User Current Employee  F****  Business Development - May 6, 2022",
3.0,Competitive comp and that's it ,"Compensation , start up, most entraining app, good brand name ","Culture, no work life balance, transactional work, operates like a call center ","Verified User Current Employee  j*****  Lead Business Analyst - May 5, 2022",
3.0,It's not everyone ones cups tea,Exceptional talent to work along sideNon Hierarchical set up Frequent opportunity for comp/promo adjustment Global set up,"Growing rapidly, with little focus on cultureHard handed HQShort term thinking with often knee jerk reaction ","Verified User Current Employee  a******  HR Administrator - May 5, 2022",
4.0,Your mileage may vary,"Overall can be a great experience if you are on the right team, which I was. Most of the cons came at the organization level. Some pros from my experienceGreat payBonus and salary raises (for high performers)Opportunities for people to move into people mgmtPeople are friendly and all around awesome to work withHigh work ethicDiversity and inclusion","Avg tenure here is probably a yearFormal continued learning is nonexistent WLBComp structure is nontransparent, even for managersPerformance reviewsExecutive mgmtGlobal politicsConstant priority shiftingSetting boundaries is hit or miss with all the above","Verified User Current Employee  s*******  Product Operations Specialist - May 4, 2022",
3.0,Depends on your team,Start up feeling Wide scope for learning Good teammates and positive culture ,No work life balance Very limited benefits and career growth ,"Verified User Current Employee  S*****  UX Analyst - May 4, 2022",
3.0,bad wlb,compensation is overall good and company grows fast so far.,"yearly salary growth is slow. wlb is bad, management needs to be improved","Verified User Current Employee  K*****  Software Developer - May 3, 2022",
4.0,Okish,- Used to be great pay- Great tech- Good for learning new tech,- Not much room for career growth- Very chaotic - Need to spend more time on eliminating toil,"Verified User Current Employee  L*****  Site Reliability Engineer - May 3, 2022",
5.0,"Unique company, once in a lifetime opportunity ",Not everyday you see a new company beating competitors in a global scale. Will have exposure to a high growth global business that rely a lot on local support to shape growth ,Have to be prepared to work hard and adapt your schedule to different time zones ,"Verified User Current Employee  b******  Product Manager/Strategy - May 3, 2022",
3.0,Room for growth but inflexible management ,"Fast-growing company, many new things to work on as they expand","Top-down approach to management, need to work extensively with counterparts in China - time difference issues","Verified User Current Employee  l*****  Software Engineer - May 3, 2022",
1.0,This is the worst company I've ever been at and I'm sad to leave because it actually pays decent. ,"TikTok is a company that pays a lot, but that's about it.  ","Probably missing a few cons, since there are so many!I'm not sure if it's like this in other orgs, but the org is completely mismanaged, with 90+ employees falling under the person.  The company's push for a flat org simply does not work well--at least not in the team that I'm in.  It leads to a complete lack of accountability instead.  Nobody takes notes during meetings, action items are forgotten immediately after each call and there is no follow through.  Random people are added to meetings, making the duration of the calls excessive, especially if they start talking.  Often, it's not even a topic that they understand or should be speaking about.  Also, large meetings are scheduled when it's something that can be hashed out in 5 minutes.  It's possible that this is a way for them to let everyone know that they are doing work.TikTok takes on the China culture of throwing bodies at problems, rather than working on improving processes.The processes are so inflexible that we have no choice but to throw more bodies at problems.95%+ of the people on my team are incapable of performing their role effectively.  It's either from a lack of work ethics, or just doesn't understand the subject.  Do we not actually interview new hires or something? I've never worked at a company where there is this much incompetence stacked together.  ","Verified User Former Employee  L******  Infrastructure Engineer - May 2, 2022","This is the worst run company I've ever been to and I don't see it getting any better.  Each day that passes, I see the ship sinking more and more.  In order for it to be a good company, we need a complete overhaul.  "
3.0,"Good infrastructure, bad coworkers",Higher Compensation than its'peersGenerous annual bonus (3x or more),Get ready to work a 3person's jobManagement will keep u on ur toes by not giving best reviews eventhough u r the best employee,"Verified User Current Employee  z****  Senior Account Manager - May 1, 2022",
4.0,Great ethos and culture,"Bytedance - TikTok embodies core values that resonate beyond the workplace - working hard, and owning your calendar (amongst other things). The people there are excited about company, but the last 12+ months have been difficult due to the pandemic. Great benefits (fully vested company match-401k, lunch stipend).","Have to be comfortable working in ambiguity as there is a plethora of outdated communication docs scattered across different storages, goals become less clear further downstream. Upward movement is possible but almost feels less based on knowledge/experience and more on appearances, just my opinion. ","Verified User Current Employee  c*******  Ad Operations Specialist - Apr 29, 2022",
3.0,Messy management in the US,A loooot of high impact projects for sure. It is pretty easy to promote if you work hard enough. ,A lot of high impact projects means you also have to take on high impact projects if you want to be treated good. Don't need to say what high impact means to WLB. ,"Verified User Current Employee  B*****  Software Engineer - Apr 28, 2022",
4.0,"Too soon to tell, but so far so good.",You can apply to internal opportunities after 3 months. Strong comp & benefits. People are great. The environment is fast paced.,Work-life balance might be an issue.High expectations on bi-monthly goals.,"Verified User Current Employee  K*****  Talent Acquisition Partner - Apr 28, 2022",
4.0,TikTok ,"Non-tech, on the business side:- No budget is too big if the idea is good- very fast paced iteration of projects and programs- very easy to make an 'impact' if you're willing to brag ","- absolute lack of transparency. Unwritten rules that we have to tiptoe around.- lack of communication, coordination between BU, regions, and functions. You can imagine the number of duplicate teams, projects, and confusion- diversity lip service- any mention of FAANG is a no-no. Hugely insecure HR and PR teams.- unimaginative leadership. What works in China is rolled out uniformly across the regions with minimal consideration of cultural differences.- senior leaders often simply puppet figureheads. HR wields disproportionate (yet fearful & unimaginative) power","Verified User Current Employee  a********  Policy Manager - Apr 28, 2022",
2.0,Tough but has good learning opportunities ,- Good worklife balance (depends on your team culture)- A lot of learning opportunities - Tons of high calibre people- Fast paced,- More opportunities for high impact work if you can speak Chinese- Extremely slow career growth- Direction from management very unclear- Lots of burnt out engineers- High turnover- Littl to no raise,"Verified User Current Employee  U*********  Senior Back End Engineer - Apr 28, 2022",
3.0,"Bad work life balance, great projects","The company has great projects to work on, very impactful ","Work life balance is not too good, you are expected to work 12+ hours","Verified User Current Employee  l*****  Software Engineer - Apr 27, 2022",
4.0,No room for growth ,Some very smart people here but they become unmotivated fast,"Lack of transparency, no room for career growth, too many ongoing projects at once without prioritization ","Verified User Current Employee  s********  Product Manager - Apr 27, 2022",
1.0,You can tell this company does not care about its culture. No room for growth. Misalignment everywhere,You can say you worked at TikTok but other than that. It's trash,No growth opportunities especially in GBS. Tons of micromanagement happening,"Verified User Current Employee  i*****  Content Operations Specialist - Apr 27, 2022",
3.0,Great place for growth,A lot of anatomy.Flat structureAccessible leadersPlenty of learning opportunities ,Work is hard and toughCompensation is averageCulture is not for everyone,"Verified User Current Employee  h*******  Program Manager - Apr 27, 2022",
3.0,Good stepping stone as a new grad,- Learn a lot- TikTok is an exciting product and moves really fast,"- Lots of things are in mandarin (sometimes bots will send critical messages in mandarin), though meetings are always in english if there are any non-mandarin speaker- People outside of my team dont seem super friendly here","Verified User Current Employee  h*********  Software Engineer - Apr 27, 2022",
4.0,A good place to polish resume,"Great opportunity to polish profile, easy to be involved in highly impactful projects.","I don't know where to start but the major issue is that there's no clear growth trajectory and every time a new opportunity comes, leadership prefers to hire someone externally vs promoting employees.","Verified User Current Employee  b****  Marketing Director - Apr 26, 2022",
3.0,Not bad but not great,Y'll learn a lot as it is very fast paced company.,WLB is not great. There is a lack of transparency.,"Verified User Current Employee  p*****  Software Analyst - Apr 26, 2022",
3.0,Poor WLB but Full of learning opportunities and reasonable work scope for new hires,"A lot of opportunities where you either can lead projects with reasonable scope. Compared with FB or G, at least it's easier to get opportunities of high visibility projects. And also it's a result of short hands. Not sure whether this advantages will last long with current growth speed. ","Very obviously the 996 culture and the toxic culture are big cons of the company. With cheaper labor costs in China, Chinese employees are willing to get overtime due to fierce competition locally and not so good economy in China now. Even though Chinese government has policies to prevent big tech from demanding overtime but it doesn't help a lot. As a result, overseas employees either work overtime to keep pace with them or get scope narrowed down since the delivery speed are not that good compared with that in Beijing (but still good enough if compared in US). ","Verified User Current Employee  s*****  Software Engineer - Apr 25, 2022",
3.0,Most great things so far! ,"Decent work life balance, great people that I get to work with, in GBS very positive leadership. ","Lack of overall transparency, overarching Chinese office culture, company as a whole seems not to care about happiness of workforce as a whole based on benefits, policy, and pay.  Bi-months Make it challenging be strategic, everyone I've talked to is underpaid, overall there are no processes. ","Verified User Current Employee  d*****  Client Solution Manager - Apr 25, 2022",
3.0,Overall Good Company,"Great people, collaborative work environment, cool projects. Good benefits in terms of healthcare and retirement options. Stock comes in RSU's. Things move at a rapid pace, easy to create opportunities and work really close to the product. ","Team structure is built for churn and burn. They don't value loyalty but instead would rather milk as much work out of you until you burnout and leave. Pay isn't competitive within the market, no leveling or transparency for career growth opportunities. No WLB. Chinese work culture bleeds into US. Lots of expectations to be online at all times lots of late night meetings. ","Verified User Current Employee  p******  Product Manager - Apr 21, 2022",
3.0,Poor work life balance in China,"Flat structure, good pay, platform and resources if you want to do sth","Long work time, pay increase.  Bu can be shut off entirely ","Verified User Current Employee  q******  Strategy & Business Development - Apr 21, 2022",
3.0,Good WLB if you set the borders straight,Cool productLots of stuff to work onGreat tech stackPay is fine for ex-Meta,"Teams are bad at understanding dataPoor culture of management, don't really appreciate the peopleHRs have more power than managers even at director level","Verified User Current Employee  D****  Data Scientist - Apr 20, 2022",
3.0,"Good for managers, not great for ICs",- Fast scope growth if in management position- Scope of projects is bigger versus FAANG- Culture of moving quickly means less bureaucracy although still exists - Cool product  ,"- Compensation is 25% below market, no stock refresh- Poor transparency and little focus on people issues which isn't changing anytime soon- CEO is a CFO so lacks a real, inspirational vision ","Verified User Current Employee  q*****  Product Manager - Apr 20, 2022",
5.0,Great chance to grow,Large scope and nice people to work with and learn fro,Late night meeting and some urgent work in the rest time,"Verified User Current Employee  X********  Software Engineer - Apr 19, 2022",
4.0,Great Ownership,- Lots of ownership and responsibility- Fast-paced environment- Constantly shipping out features,- Not the best WLB (team dependent)- Docs are in Chinese- Ambiguous career growth milestones,"Verified User Current Employee  u*****  Software Engineer - Apr 19, 2022",
3.0,Work life balance isn't good,Pay is not too bad but rsu is still paper,Management have been talking about improving wlb for so long but not much action is taken.,"Verified User Current Employee  j********  Software Engineer - Apr 19, 2022",
3.0,New employee.. so far so good,"So far so good. Good benefits, everyone seems collegial and friendly. ",Haven't been in the seat long enough to have any cons.,"Verified User Current Employee  d*****  Software Applications Engineer - Apr 18, 2022",
3.0,Good place to increase leveling and scope,-Larger scope -Smart colleagues -Build new programs/processes -Moves quickly ,-unclear promotion path -WLB can get tough if you don't set boundaries ,"Verified User Current Employee  p*****  Operations Manager - Apr 15, 2022",
3.0,It all depends.  But always move faster,Most fast People generally empoweredGood compSmart people focus and hard working ,996:  working with Chinese teams = meetings till 11 pm Managers in China don't care about your development at all just get your work done Internal tools are still poor and many system dont translate content into English ,"Verified User Current Employee  c********  Product Manager, Technology - Apr 15, 2022",
3.0,"Good place to start career, but not to stay","Fabulous health insurance, good teams exist at the company, exciting place to work at the moment",I feel like there is no potential for me to grow at this company and the compensation is poor,"Verified User Former Employee  j*****  Sales - Apr 15, 2022",I am leaving for personal reasons and to pursue other options
4.0,efficiency is key,efficiency is keygreat productfun coworkersimpactful workfast iteration,wlb sucksmost docs in mandarininfra breaks a lot,"Verified User Current Employee  p****  Software Engineer - Apr 15, 2022",
5.0,A company that could inspire creatity,"Onsite meal 3 times per day(breakfast, lunch, dinner), team collaboration atmosphere is pretty good","kind of under pressure, maybe time zone gap if work with other countries' teammates","Verified User Current Employee  V*****  Human Resources - Apr 14, 2022",
3.0,Really depends on the team you're in,Make sure you get into a good team and it could be good for you,"Hiring bar pretty low, lots of people unable to excel","Verified User Current Employee  f*********  Product Marketer - Apr 14, 2022",
3.0,"Questionable WLB, horrible culture, inequalities, ineffective leadership","Interesting engineering problems, talented/smart people, good base pay. Good bonuses ","Questionable WLB, horrible culture, inequalities, ineffective leadership. Pay for performance culture is horrible, no inflation adjustments. Management ignores employee concerns. IPO is nonexistent ","Verified User Current Employee  X*****  Software Engineer - Apr 14, 2022",
3.0,Almost no salary adjustment ,"Competitive salary when you onboard. Big company background, smart colleagues.",You must work very very hard to get salary adjustment every year. ,"Verified User Current Employee  G*****  Software Engineer - Apr 14, 2022",
3.0,Mixed baggage ,"There's plenty of opportunities and room for improvement for people to jump in, as long as you are driven. It's a good place for people to develop new skills and stretch themselves a bit. ","Lack of coaching and mentoring. Most of time, people have to figure things out completely from scratch by themselves. Lack of leadership, leaders are mostly disoriented and disorganized. Culture is Chinese culture, meaning micro management, blame and figure pointing, which is really toxic. ","Verified User Current Employee  j*****  Talent Acquisition - Apr 14, 2022",
3.0,"Not a bad place to work, the overall vibe is chaotic though haha ","You work with amazing coworkers,Swag sometimes but would love more, Employee recognition,","Honestly it's the Wild West, there's not much organization - everyone has no idea what's going on ","Verified User Current Employee  G*****  Marketing Associate - Apr 14, 2022",
2.0,"Good benefits, but devoid of culture","Pay is reasonably competitive, exceeding most other tech companies in Singapore.","The culture is pretty poor, with little importance placed on work life balance if anything. Career growth is kept intentionally secretive.","Verified User Current Employee  m******  Senior Marketing Manager - Apr 14, 2022",
3.0,"Great opportunity to be part of something very big, but issues from lack of market autonomy and career growth ",- Bonus- Opportunity to be part of something big- People,- Career growth - compensation doesn't match up against competitors ,"Verified User Current Employee  K*****  Manager of Sales - Apr 14, 2022",
3.0,Wouldn't recommend unless you are already established in your career ,Great opportunity to make an impact because everything is new,Incompetent leadership and management Top down management Minimal career progressionBiased performance reviews Mediocre comp,"Verified User Current Employee  z*********  Product Marketing Manager - Apr 13, 2022",
2.0,"Bad WLB, poor management",- Potential high personal growth depending on the team- high scope,- Late night meetings with CN- poor management- unclear career path,"Verified User Current Employee  d*********  Software Engineer - Apr 13, 2022",
4.0,WLB is actually ok. ,"Great colleagues, knowledge is everywhere. People are willing to share. ","Lack of promotion, high attrition rate. Sometimes odd hours meetings. ","Verified User Current Employee  W*****  Product Manager - Apr 13, 2022",
3.0,Not as bad as they say,- Most teams allow for Hybrid work- Coworkers are smart and competent - Decent health benefits - Not many assholes- Lots of ability to transfer,- I've heard comp is better elsewhere - Not super creative - No culture of funâ€¦very work focused ,"Verified User Current Employee  K*****  Product Marketing Manager - Apr 13, 2022",
4.0,Hit and miss depending on the team you join ,"I was lucky to get a good manager, and he treats us rather well. ","Need to get better at translating, but that's just growing pains ","Verified User Current Employee  D*****  Engineer - Apr 13, 2022",
4.0,"First job, compensate well FTE ","Large scope, I have a great leader and manager who help supports meTeam support Collaborative culture ","WLb, China team= late night meetings High expectations Comp is average but I only have 3 years experience ","Verified User Current Employee  w*********  Technical Recruiter - Apr 12, 2022",
1.0,Rapidly growing company that had a lot to learn,"As most roles, processes and responsibilities are new, you'll be able to make a significant impact in the company if you work to help define them. ","Work life balance is severely lacking. Most of my colleagues worked odd hours just to attend a meeting. Their idea of work life balance is to give options for employees not to attend meeting after 8pm on one of the weekdays. They also give awards to those who work long hours. Ambiguous career progression. While I exceeded most of the expectations and HR preached in meetings that that is more important than tenure, I wasn't even considered for a promotion and they gave opportunities to those with longer tenure and can speak Mandarin. They have multiple ByteStyles but that doesn't really carry any weights. ","Verified User Former Employee  a****  Technical Account Manager - Apr 12, 2022",Lack of work life balance and bad culture within the company. 
4.0,"Great leadership, lots to do","Pays well, better work life balance than my ex consulting job, if you start out now you'll definitely be leadership in a year or two because everyone is new there","The perks such as fitness fund isn't as good as other places. I'd say for a tech company there are also missing items, for a company taking on twitter and Facebook don't have the same office perks.","Verified User Current Employee  t********  Associate IT Analyst - Apr 11, 2022",
4.0,"Great growth opp, weak payroll ",-new business = new opportunities - management support - personnel development - great product & strong momentum ,-payroll not competitive - weird processes -lack of transparency - no salary raise for promotion ,"Verified User Current Employee  K*****  Sales & Business Development Manager - Apr 11, 2022",
4.0,"Great team, but bad comps","My direct managers and closer team are amazing, supportive, and really fosters room for growing and learning. ","Some inter-team politics that seem to get more severe the higher up you go (on the lead-level) Comps and benefits are definitely lackingYou can definitely see the Chinese influence in workplace norms (overtime is expected, humility is expected in personal reviews, some restrictions imposed on flexible benefits for APAC offices)","Verified User Current Employee  o*****  Client Solutions Manager - Apr 11, 2022",
3.0,"Poor WLB, lack of transparency, low comp","-You'll meet some wonderful people, TikTok tends to attract really passionate and interesting folks.  -There's some great perks (depending on your location), meal stipend, internet/phone/gym reimbursement, and 100% covered healthcare. -Personally, I have a wonderful manger that advocates for our team","-Unfortunately the compensation tends to be below the industry average. -There is so much misalignment from team to team.-It is extremely difficult if not impossible to transfer teams, despite whatever the company says about growth. -Communicating with teams in Asia is an absolutely headache due to time differences. Lark never stops.-Cultural differences between NA and Asia are pretty much ignored. -You can never be productive enough. Constant push for more, more, and more. (poor WLB)","Verified User Current Employee  Y*****  QA Analyst - Apr 10, 2022",
3.0,Innovation is appreciated and encouraged. Wlb is bad a,"Comp is good if you are from faang, decent benefits and scope for career progression ",Work life balance Lack of transparency in levels and promotions ,"Verified User Current Employee  b*********  DevOps Engineer - Apr 10, 2022",
3.0,Decent comp and not much more ,Fast growing company in terms of user count. Decent comp. ,Incapable teams. Lack of ownership. Chaotic. Weak management. Lot of China dependencies. ,"Verified User Current Employee  a*****  Product Manager - Apr 10, 2022",
1.0,"Good comp, good product, awful culture",The comp is competitive and the product is very interesting,Bad work life balance. 996 culture exists even in US and decision making for big decisions is all based in China.Big disadvantages if you do not speak Chinese,"Verified User Current Employee  T*********  Engineer - Apr 10, 2022",
2.0,Toxic culture; don't join coz the app is famous ,Large scope but expect poor execution. No firing policy in place.,Copy culture; literally you are asked to copy Monolithic and toxic cultureLandmine if Dept of labor investigates this company,"Verified User Current Employee  b*****  Product Manager - Apr 9, 2022",
