Rating,Description,Pros,Cons,Author Info,Resignation Reason
3.0,"Work hard, ship cool products, spend your life on it",* Good comp* Interesting problems to solve* Talented peers,* Irrational rating process - everybody is average by default* Corporate culture dictated from China. Absolutely no power or control in the US. Not a global company by any mean* Language and cultural barriers are everywhere. Westerners are always in disadvantage* Long hours: working 12-16h a day is expected,"Verified User Current Employee  r*****  Senior Manager, Product Management - Oct 12, 2021",
4.0,Great place to grow and learn,- Hypergrowth phase- Excellent talent and consequently peers to work and learn from- Flat structure,- Flat structure also means finding people for specific things can be hard,"Verified User Current Employee  l*******  Data Analyst - Oct 11, 2021",
4.0,no wlb ,"Engineer culture is good here, which get some respect .",Bad Wlb. Pay get poorer recently. Run! Don't come if you are new graduates ,"Verified User Current Employee  J*********  Software Engineer - Oct 10, 2021",
4.0,Work life balance is okay but language is a problem,Compensation and benefits are good.Culture is good and usually the hires fit the culture.,"If you do not speak chinese, get ready to suffer during meetings.","Verified User Current Employee  s*******  Engineer - Oct 10, 2021",
1.0,Terrible WLB and Strong China Dependence,- High pay- Get to work on projects with high impact,"- Almost everything has to go through China- Frequent late night meetings- Teams in China don't really care about US teams much and unresponsive to messages, even though they control everything- Leadership fails to address issues like WLB and burnout- Docs and meetings are often in Chinese, even if there are non-Chinese speakers- Leaders expect us to work even at night","Verified User Current Employee  m********  Software Developer - Oct 9, 2021",
3.0,High Visibility and Impact but Poor WLB,Projects are high visibility and impactful. Very cross-functional and allows you to learn more about what each time does.,Poor WLB. Awkward work hours. A lot of Eng resources are based overseas so priorities are dependent upon overseas bandwidth.,"Verified User Current Employee  O*****  Program/Project Manager - Oct 8, 2021",
1.0,"Bad. no transparency, no growth, no wlb, run ","Very bad, no pros here other than you say you work on TikTok app. Money is a scam, RSU valuations they offer are way too high. HM and recruiters keep lying to candidates to trick them into signing. Also all teams are awful, no exception. ","Mandatory late night meetings, long hours, weekends tooNo wlb, no respect for wlbDeaf tone leadership, all of which is in China.No promo, barely any raise if you get one.No growth encouraged, just push out crap code like a monkey asap.Discrimination to non Chinese speakers by china coworkers oftenTerrible engineering practicesInexperienced and incompetent managers, PM, tech leads Large attrition, low quality talent ","Verified User Current Employee  d*****  Engineer - Oct 6, 2021",
4.0,Organized chaos ,Fast paced. Learn a ton. The structure is flat and all ideas are valid.,Compensation is not transparent. Global teams so around the clock hours (not always necessary) ,"Verified User Current Employee  p*****  Produce Manager - Oct 6, 2021",
3.0,Good career advice poor work life balance,I was able to explore a couple of interesting projects at one time since we are understaffed. also the product or the working environment is pretty interesting so I enjoyed my work content,Bad work life balance. High pressure. Long work hours hurt my health both mentally and physically ,"Verified User Current Employee  U*****  Data Analyst - Oct 6, 2021",
4.0,Good,Pretty good experience so far while at Bytedance. Smart people work here. ,Not much to say so far with my experience at Bytedance. ,"Verified User Current Employee  T*****  Designer - Oct 5, 2021",
5.0,great growth and not so bad wlb,"Growth as a product, as a company and as an engineer",Improve culture like gf. Maybe add refreshers. More care from managers,"Verified User Current Employee  i*****  Engineer - Oct 5, 2021",
2.0,Poor work life balance,Fast growth and interesting time to be at the company,"Poor work life balance, evening meetings, competitive culture, unclear roles and responsibilities, inexperienced organizational leaders who are focused on political gain ","Verified User Current Employee  d********  Strategy Associate - Oct 4, 2021",
2.0,below expectation,challenging work. once have a lot of talents but most of them left.,not much career growth. like to solving problem by putting more manual efforts rather than making system better.,"Verified User Current Employee  V*****  Senior Software Back End Engineer - Oct 4, 2021",
2.0,Terrible,None that other companies don't offer with significantly fewer headaches,"Leadership, direction, strategy are all offâ€”fire everyone and start over","Verified User Former Employee  y*********  Product Manager - Oct 3, 2021","Tired of no growth, no career dev, below market pay etc"
4.0,Good TC,Total Compensation is great for engineering. Good work life balance if you set your own boundaries.,Communication is pretty poor and there's often an information overload,"Verified User Current Employee  x*****  Senior Engineer - Oct 3, 2021",
3.0,Bad wlb,The compensation is highGood productNot that bad wlb,A lot of Chinese documentBad managementNot so organized ,"Verified User Current Employee  Y*****  Software Engineer - Oct 3, 2021",
3.0,Okish overall ,"High impact, interesting product, fast moving, pre-IPO equity share program. ","Poor leadership , Low quality new hirings , Lack of harmony ","Verified User Current Employee  d***  Produce Manager - Oct 3, 2021",
4.0,So far it's good,"Good career growth, interesting work. Nice people. Good benefits overall",Fast paced. Hard deadlines. Can have evening calls if collaborating with china team,"Verified User Current Employee  k*****  Software Engineer - Oct 2, 2021",
4.0,There are a lot of new projects to be done. But the management can be improved ,The upper class is not established. Very little politics.  Benefits are also not bad.,The management can be improved as many teams involve people from different countries.,"Verified User Current Employee  j********  Software Engineer - Oct 1, 2021",
3.0,Comp vs WLB,"Good comp, work can be v impactful depending on your team","WLB generally not great, but how bad is team dependent ","Verified User Current Employee  R*****  Software Engineer - Oct 1, 2021",
2.0,Poor work life balance and not-so-great culture,"Interesting product, fast moving, and talented people. On some teams there is a great opportunity for impact because the team is understaffed and so you are spread thin. You get your hands in more projects. ","This company doesn't care about you. You are a disposable number brought in to be burnt out and used. I was the victim of a bait and switch. Most of my collaborators ended up being in China which means being treated like a second class citizen, not having much ability to advance, or to have the impact that I'd want to have - not to mention the ridiculous hours. ","Verified User Current Employee  G*****  Product Designer - Sep 29, 2021",
1.0,Bad culture ,You can be in charge of larger scope.There's a chance for ipo.,Bad culture. Company doesn't care about employee feeling or growth. Management is also very poor.,"Verified User Current Employee  h*****  Product Manager - Sep 29, 2021",
1.0,WLB is actually not bad. But too top-down. You won't get promoted unless you know Chinese.,Some projects are pretty teach heavy. Can learn a fair amount here.,Everyone is planning to leave the moment they get the chance to. Career progression is non existent. Still a long way to go in terms of moving from Chinese to English.,"Verified User Current Employee  h****  Software Engineer - Sep 29, 2021",
4.0,Amazing Growth,"Incredibly growth; at the center of everything happening in technology and entertainment; probably the most innovative company in the world; you get to fight Facebook which is a purely evil company. Strongly disagree with the narrative that everything is decided by teams in China. There are a limited number of teams (and shrinking) that are led out of China, but the key management is based in the US and Singapore.","You have to work hard, but guess what: competing with entrenched giants/monopolies like Facebook and Google is hard work.","Verified User Current Employee  R*****  Corporate Development - Sep 29, 2021",
3.0,Bad wlb,Pay is okCo workers are competentgood perks in general,Long hours at nightProcesses are not establishedHave to figure out things on your own,"Verified User Current Employee  j*****  Software Engineer - Sep 27, 2021",
5.0,Not as bad as everyone thinks ,Non Chinese speaker. Have China reliance still very reasonable work hours as an engineer 20-30 hour work weeks. ,Sometimes late night meetings but can make your own schedule. ,"Verified User Current Employee  f*****  Software Developer - Sep 27, 2021",
1.0,Good pay but that's it,"If you negotiate we'll, they will pay you a ton of $$$ ",WLB and culture is the worst you will ever experience if you need to work with China,"Verified User Former Employee  l*****  Marketing Manager - Sep 27, 2021",Need my sanity back and buying back my soul from the devil
4.0,Great place to grow technically,Tech stack is good and (most) people are nice. Lots of learning if you know Chinese,Work life balance - people discussing project late night and on weekends Culture lacks transparency,"Verified User Current Employee  t********  Software Engineer - Sep 26, 2021",
1.0,"996 is fake, 12127 is real",Salary is 30% higher than best FAANG offers ( but only if you negotiate),Work life balance does not exist. HR tries to lowball you on offer. Work 5x harder for 30% more pay. Take the job if you need to pay off a loan shark or kidnapper's ransom. Management is bad and scared to change.,"Verified User Current Employee  9*********  Technical Solutions Analyst - Sep 25, 2021",
1.0,Worst company I have ever been in my career,"High growth, which translates to more TC & ownership. But be aware that RSU value may be inflated by HR","Terrible culture. Basically zero care for non-Chinese speakers, and no genuine effort to fix it. Untrustworthy HRs who will gaslight you for expressing concerns.","Verified User Current Employee  a*****  Software Engineer - Sep 25, 2021",
2.0,Top down culture,"You can have a good start. Perks like daily food coupons, goodies for every festival etc",There is no way you can be innovative. You only need to execute what the teams in China want. There is no scope to design a strategy. ,"Verified User Current Employee  Q*****  Quality Control - Sep 24, 2021",
2.0,Organizational Structure makes it hard to succeed,Great co-workers and you will need to fix everything that is broken ,"No career growth, no organizational structure, a lot of leader pleasing. Mgmt doesn't really know what they are doing. ","Verified User Current Employee  b*****  Operations Management - Sep 24, 2021",
2.0,Working for HQ team = No WLB,"Growing company, fast paced and changing quickly, good to come in and create your own value and path for growth/ownership. Pay is decent. ","If you work on or with HQ team then expect horrible WLB, constant change leaves no time to scale up and make projects better, constant push for more growth and new initiatives without working on current projects to make more efficient, team members come and go as seems to be high turnover, little actual control very top down driven decision making causing projects to constantly be changed moved or even whole teams reorganized. No leadership or vision, unclear and opaque Hr policies and compensation and promotion policies. Language issues will be a problem for promotion or xfn relationships depending on your team. ","Verified User Current Employee  V*****  Marketing Manager - Sep 23, 2021",
4.0,Great people to work with and interesting work,- Smart and driven people- Interesting work- Good level of responsibility and scope- WLB is pretty good; there are some days that require longer hours but people are generally very respectful of boundaries ,"- Working across a lot of time zones- There's a disconnect between HQ and the other offices- Depending on which teams you work with, language barriers can make working together more complicated (but not impossible)","Verified User Current Employee  K*****  Operations Manager - Sep 23, 2021",
3.0,Bad when reporting to Beijing ,"Good and fun brand on CV, start up culture if you like the grind","Extra difficult working alongside Beijing management, difficult to convince them of cross cultural differences and ways of working ","Verified User Current Employee  a******  Human Capital Analyst Manager - Sep 21, 2021",
4.0,Massive scope but poor WLB,- Massive scope- High growth- Self-selective culture (people are motivated),"- NO WLB- For those who don't have a fit, poor culture","Verified User Current Employee  M*****  Product Manager - Sep 21, 2021",
3.0,Difficult to work without knowing Mandarin,- Supportive teammates and manager- Great benefits & compensation- Flexible ,- I find it hard to contribute to any meeting without using Mandarin,"Verified User Current Employee  K*****  Partner Content Specialist - Sep 20, 2021",
1.0,Chinese company ,Tiktok is popular among youth peopleLots projects to work on,"It's Chinese style, which may not a bad thing to develop world class products.But for people in US, don't be naive that you can success there, even you are Chinese. Happy life requires happy work. Think about it.","Verified User Current Employee  d******  Software Engineer - Sep 18, 2021",
1.0,Rubbish place with rubbish leaders,Great product cool tech huge and fast growing user base,Everything else - leadership WLB colleagues scope etc IPO opportunity progression increment,"Verified User Current Employee  f*****  Product Manager - Sep 18, 2021",
4.0,Rocket ship with smart friendly ppl,Game changing projectsNice friendly coworkers smart tooInteresting work Good pay,Work life balance not greatNight meetingsOverlap between teams,"Verified User Current Employee  b*****  Produce Manager - Sep 18, 2021",
2.0,"Great pay, horrid work culture and leadership, not progressive ","Pay is top notch (if you negotiate for it, they are happy to low ball and have huge pay bands)A lot of smart talented colleagues","Awful leadership, every decision made in China by HQ, often by fresh out of college analysts with no experience in international markets.US leadership has zero autonomy.HQ has lots of shady spying tactics on devices, records and transcribes and analyzes all meetings on lark. Not a culture that believes in progression, such as Promotion/Raises. Very few people have any sense of career path. ","Verified User Current Employee  g*****  Partner Marketing Manager - Sep 18, 2021",
5.0,Overall good company if you can perform under pressure,Company growing. Everybody is having high work ethics. Bonus is good sometimes. I can see the future,They do not hire the right talent. Too many inexperienced people joining in.,"Verified User Current Employee  h******  Program Manager - Sep 17, 2021",
2.0,Avoid,"- WLB on my team is decent- My manager is ok, i.e. no micromanaging","- Lowball shit offer that I only took to get experience out of school- Awful company culture, everyone hates HR with good reason (they don't care about you and aren't subtle about telling it to you in all hands meetings)- Most documentation is in Chinese- The CCP literally has a board seat now- The company will likely never IPO due to regulatory pressures from China and the U.S. = RSUs are only worth what the company will buy them back for","Verified User Current Employee  v*********  Software Engineer - Sep 17, 2021",
5.0,"if you chase on wlb, please leave ",Always day1 and young company culture High potential and opportunities Generous RSU ,long work timestrict vesting schedule like 15/25/25/35Low benefits ,"Verified User Current Employee  M*******  Manager, Software Engineering - Sep 13, 2021",
1.0,996,Nothing out of ordinary. Benefits are standard. Interesting projects to work on," +they love Amazon and try to emulate their work culture+996 work, meetings on weekends and performance expectations that will have you working 12 or more+ stagnant salaries coupled with inflated equity valuation by HR to avoid giving TC adjustments+no RSU refreshers+bad vesting schedule. Starts first year at 15%.+bad code practices and a lot of technical debt+Chinese are the only ones getting promotions because they can help communicate better with Beijing+management will tell you you are lucky to work at TikTok  if you complain about WLB. This is told during all hands meetings.+management will tell you to avoid taking vacations beyond 1 day to avoid work disruptions+some people that got covid took only half day off. That is how workaholic this place gets. +promotions often come without raises or total compensation adjustments+no imminent IPO. Likely not to happen in US","Verified User Current Employee  b*******  Software Engineer - Sep 11, 2021",
1.0,Losing my hope,If you speak mandarin or worked at a competitor and bring specific domain expertize you might do well on the short term. If you were a project or programme manager at the competitor TT can enable you to do the switch as long as you bring competitive intelligence.Also TikTok is a great product and can bring some pride on your work. ,There is a lot of pressure. Most people are constantly told are not good enough (for their level). Insecurity is created to push people to work harder. Colleagues start competing to get ahead and reduce the pressure on themselves and this leads to toxicity. I have seen good and successful employees transform and sabotage and lie about others when they feel their bimonth goals are not going as expected. ,"Verified User Current Employee  f*******  Product Manager - Sep 11, 2021",
1.0,No WLB no career growth bad management ,They hire people with no people management experience into people management roles- good for people wanting to move into management ,No WLBNo career growth path No refreshBeijing coworkers are rude and Beijing leadership thinks that's normal Leadership treats employees as enemy ,"Verified User Current Employee  P*****  Software Engineer - Sep 10, 2021",
2.0,Worst WLB. Enough said,Nothing other than competitive comp.Wfh benefit for internet.Nothing other than filing space here,Inept workersCoworkers with bad attitude and management styleExpect to speak Chinese or else get ready to have 0 contribution and no BytestyleEvery month you see new hires coming on board. It used to be 20-30 every month. Now it's 2-3 once everybody caught wind of how horrible this place isRun far away,"Verified User Current Employee  j*****  Software Engineer - Sep 9, 2021",
3.0,Company is built like è±†è…æ¸£å·¥ç¨‹ Tofu buildings. Looks impressive from outside but an absolute shambles and a mess,Company will probably IPO for nice lucrative share price. But since their stingy as hell with RSU most employees will gain nothing or be enriched by such event.,"Plenty.Terrible compensation. Ridiculous career progression policies thar can have you move up in the company but you'd remain on your current terrible salary and job level until performance review grades are met. Then and only then will they consider you for a compensation adjustment.HR is clueless and cant answer basic questions.Incompetent, spineless and toxic people in companies management.Still very much a China centric other offices have little autonomy if any","Verified User Current Employee  Q******  QA Analyst - Sep 9, 2021",
4.0,Good company in general ,"Defeat some rumors first--It's fast paced, but not too bad. It's restructuring a lot, but does not lay off but rather internal transferIt puts lots of weight on data privacy. Seriously shouldn't lose any case on this aspect","When business leadership says something is high priority, every team, literally, everybody, jumps on to it. No centralized planning. Very messy. Lots of internal competition among teams. ","Verified User Current Employee  c****  Data Scientist - Sep 8, 2021",
4.0,Fast paced growth,They provide the best compensation in the Bay Area and a fast growing start up. Pre-ipo stocks. ,No one have idea on the mission or vision of the company. ,"Verified User Current Employee  i********  Software Applications Engineer I - Sep 7, 2021",
2.0,It's ok,Compensation / Benefits are on par with other major tech companiesWLB depends very much on your specific team.  Mine is not too bad. ,Supporting departments such as Finance and IT are a joke.  Getting expense reimbursed is an absolute pain! ,"Verified User Current Employee  5***  UX Consultant - Sep 6, 2021",
1.0,Horrible WLB and Culture,I'd not recommend anyone to join here. Please don't become part of a problem by joining here. ,"The leadership does not care about employee welfare at all - never listens to the employees, not remote friendly, bad WLB, control oriented, caters a culture that creates constant stress, never transparent - very opaque. Almost everyone suffers from burn outs. The way they run this machine is by treating employees as disposable as possible. They run a factory here. Employees are just new raw materials they can buy off market. ","Verified User Current Employee  d***  Software Engineer - Sep 4, 2021",
3.0,Very fast growing company,Opportunities to take on additional scope and progress very quickly,Worklife balance is often a challenge - not a focus for leadership,"Verified User Current Employee  q*****  Strategy & Operations Analyst - Sep 3, 2021",
2.0,Need Chinese to survive,"Okay perks, great ownership culture, wide scope of work, high impact.",Need to know chinese.I wish they put chinese in the job requirement. What a scam.They sold the company as a global company but that's delusional. Everything is in Chinese. People in China prefer to speak Chinese. Your colleages are also mostly Chinese.Basically you have no future here if you are not Chinese.,"Verified User Current Employee  q*******  Software Engineer - Aug 28, 2021",
1.0,Poor work life balance,Compensation is not bad. Food is okay. Not a lot of office politics,Very very poor work life balance . Late night meetings with China team,"Verified User Current Employee  i******  Software Engineer - Aug 27, 2021",
2.0,Great product poor culture,Great and enthusiastic people. Wonderful user facing product that's truly part of the zeitgeist,"Rapid growth means uneven hiring across most client facing teams. Lack of transparency - promotions seem based on favouritism, salaries very uneven across teams performing the same role. Work life balance not great. ","Verified User Current Employee  s***  Client Solution Manager - Aug 27, 2021",
4.0,Good culture good scope ,"Good pay, good culture (at least on TikTok Frontend), interesting problem solved with new tech stack. Plenty of things/projects to be built. Dunno about career growth yet, if good, then I can say the place is ideal. ","Relatively long hours, language barrier for non Chinese speaking folks, may need to work at night (can be a pro if you prefer it)","Verified User Current Employee  n*****  Software Engineer - Aug 26, 2021",
3.0,Learned a lot,"Networking was a positive, great learning experience, interesting collection of swag","Work Life balance, erratic compensation, little career growth, poor management","Verified User Current Employee  s*********  Policy Manager - Aug 26, 2021",
4.0,"No wlb, good pay",Very fast paced and lots of opportunities to get noticed,"You have to juggle a lot of things at once, and health will be impacted","Verified User Current Employee  q***  Software Engineer - Aug 25, 2021",
4.0,"Silos, tribal, no one knows anything but what they are doing ","Top Social Network, surpassed FBMassive potential for growth Ok compensation ",Siloed Tribal Knowledge is minimal Hard to get information No work life balance ,"Verified User Current Employee  C********  Cyber Security Analyst - Aug 25, 2021",
3.0,Heavy dependency on teams in China,Some cool products to build.Nice people in US teams.,Too many dependencies on China teams and leadership team don't want to address them. US teams are struggling with the hours.,"Verified User Current Employee  c***  Engineer - Aug 24, 2021",
3.0,Great place if you're ready to work really hard. ,"Good Pay.A lot of internal tools (not sure if this should be pros or cons, but depends on personal preference)","Frequent re-organizationHigh attrition rate (in some team, 1/4 of employee left in the last 6 months). Some documentations are in Chinese. Although there's translation tools, they can be confusing. Lacks work life balance. ","Verified User Current Employee  X*****  Software Engineer - Aug 23, 2021",
