Rating,Description,Pros,Cons,Author Info,Resignation Reason
5.0,The company is definitely great but not all teams are equal,"You're working with the high growth company, definitely lots to learn","Depending on the team you're in, some can be quite good but some r the bad one to avoid at all cost.Suggest to check with team members before joining","Verified User Current Employee  f******  HR Specialist - May 2, 2021",
4.0,Good benefits,"- Free lunch- Chance to work with opensource tools, particularly tools from cncf ",- some teams are still conversing in mandarin- confusing team org structure as stated team leader is actually pretty higher up,"Verified User Current Employee  c*****  DevOps Engineer - May 1, 2021",
3.0,Decent work,Great compensation and perks. Nice managers and friendly colleagues to work with,Lack of direction in product. Difficult to standout among talent,"Verified User Current Employee  a*******  Software Engineer - Apr 30, 2021",
3.0,You will be surprised how bad the tech is,Don't need to OT much. People are nice and there is no strict deadline,You will be dealing with other teams shitty product all day,"Verified User Current Employee  H*****  Software Engineer - Apr 30, 2021",
5.0,Ability to grow,"Flexible positions, lots of exposure to new problems and collaborate to find a fix","Common to works globally, resulting in weird and long hours","Verified User Current Employee  D***  Operations Specialist II - Apr 29, 2021",
4.0,"Policy team is great, really awesome managers and interesting work.  WLB isn't so great, mostly bc of the org structure",Good managementGood payPotential ipo upside with RSUsLove the people Interesting work ,Lots of empire building from three hubsBizarre org structure that rly doesn't scaleHours are bad bc of hub structure ,"Verified User Current Employee  d*********  Policy Manager - Apr 29, 2021",
4.0,"No worklife balence, awesome people. ",See the trend and magic behind TikTok. Coworkers are super humans,"No work life balance, tend to over work, aggressive on projects","Verified User Current Employee  3*********  Product Designer - Apr 29, 2021",
3.0,Great pay and rewarding. It's still like the wild Wild West but continues to improve. ,Lots of potential to grow and some work can be rewarding. ,Work life balance is seriously terrible as we work globally. ,"Verified User Current Employee  S*****  Product Manager - Apr 29, 2021",
5.0,"Great pay, wlb isnt too bad","Smart and kind coworkers. Good career growth, top of the industry pay","Can be long hours sometimes, vesting schedule is bad, doesnt allow remote, no refreshers ","Verified User Current Employee  q*****  Software Engineer - Apr 28, 2021",
3.0,Decent company not that good,"Good products, awesome engineering team. Ambition by nature. ... ",Mostly things are centered around China. If you are chinese origin then it is good.,"Verified User Current Employee  p*****  Produce Manager - Apr 27, 2021",
3.0,Okay company,"Start up culture if that's what you enjoy, limited direction from leadership and fair amount of freedom if you complete your work on time.",-a mess-poor training-lack of clarify on return to office procedures -egos,"Verified User Current Employee  V*****  HR leader - Apr 26, 2021",
3.0,Good place to learn and grow,Fast paced and lots of opportunities to learn and growTeammates are young and open minded ,"Poor WLF, have to work until late nightNo career path Poor management, leaderships are in China","Verified User Current Employee  G*****  Designer - Apr 24, 2021",
4.0,"Good stock potential, interesting work. Poor wlb ","Interesting work, career growth. Potential to be rich LoL. Project has big impact ",Poor WLB. Not sign to cut off from China team ,"Verified User Current Employee  u*****  Software Engineer - Apr 23, 2021",
4.0,Good work balance working with genuine people that really desire change,Excellent people who are positive about work.Good vision and direction.Fast paced.,Sacrifice quality for speed.Lack of transparency.Benefits are not quite comfortable,"Verified User Current Employee  j*****  Policy Manager - Apr 22, 2021",
5.0,Lots of actions ,"I love working with my Chinese teams. They are super hardworking, knowledgeable and humble.","There are some entitled people here who will spend most of the meeting time complaining, rather than contributing. ","Verified User Current Employee  f*****  Product Manager - Apr 21, 2021",
4.0,ByteDance is a big startup with growing pains,-lots of opportunities-blistering growth rate-pre-IPO is attracting serious talent-still bigger potential upside in the validation compared with established big tech-Chinese market scale is insane -Company seems to do very well at localization-Lark (slack like tool that's the engine of the business is a super app),-Opacity from HQ and lack of transparency creates major issues for the business and erodes trust internally and externally. -Hours for meetings with HQ aren't great-Company culture isn't cohesive-HR seems to be in a tough spot with leadership vs how employees outside of China expect to be treated/communicated with -Tedious approval process and culture surrounding data access. Slows down/creates poor business decisions. Keeps information siloed so no one below a certain leadership level knows what's going on with the business.  ,"Verified User Current Employee  U*****  Sales & Business Development Manager - Apr 21, 2021",
4.0,"Poor compensation, good name","good name, career opportunities, work is interesting (ML), tools are good","poor compensation, cultural barrier, needs bilingual colleagues, no RSU,  chinese docs","Verified User Current Employee  t*****  Software Developer - Apr 21, 2021",
4.0,"Learning opportunity, fair benefits","Fast paced, lots to learn, always room to move as long you are driven",Some degree of mess / bureaucracy due to growth. Culture issues due to teething of growth company crossing many borders. WLB can be poor depending largely on location and role too. But to some degree it affects all. ,"Verified User Current Employee  x*****  Sales - Apr 19, 2021",
4.0,Great people but long hours ,The people are so collaborative and smart and passionate about what they do. Definitely a we're in this together mentality. ,"Long hours and lack of WLB. Especially on a global team, working 15 hours consistently is not abnormal. ","Verified User Current Employee  d*****  Sales & Marketing Associate - Apr 18, 2021",
4.0,Great comp,The pay is great and the culture is very good,I have my differences with the direction management is taking,"Verified User Current Employee  g*********  Sales - Apr 18, 2021",
1.0,Hey we has to work way more than 9-7 to get things done,Compensation  is the only upside. Work is average. Everyone is here for IPO money. Random chats are never complete without talking about IPO.,Average social media tech. Nothing path breaking unless you are writing effects. Standard engineering. Chinese documentation. Have to over communicate.,"Verified User Current Employee  1****  Software Engineer - Apr 17, 2021",
2.0,"996, no WLB, startup culture","- a lot of room to learn for new entry level folks- product and features move and ship quickly- bi-monthly OKR, no time to bullshit - too busy to be involved in office politics - plenty of young folks - continuous improvement on internal tools - competitive compensation ","- no work life balance, at all - expect to work at least 12hr / day Monday- Friday, sometimes sundae- Friday (expect to adapt to Beijing timezone) - language barrier struggle is real, maybe a disadvantage if you do not speak Chinese - lack of empathy for employees with family - expected to work like machine - lacking of clarity on job level expectations - low number of paid holidays - taking vacation/paid time off is â€˜encouraged' ","Verified User Former Employee  n*********  Program Manager II - Apr 16, 2021","no opportunity to move up level, due to illogical manager's expectations and unclear job level expectations "
4.0,Going to IPO,The salary is top and going to ipo make is quite attractive an,No work life balance . Have to follow the command by Beijing,"Verified User Current Employee  j*********  Software Applications Developer - Apr 14, 2021",
3.0,Culture needs work..,"Relatively new, easy to make a change in the company and stand out if you are hard-working.",culture and management really needs work if they truly want to be a global company,"Verified User Current Employee  q*****  Ad Operations - Apr 14, 2021",
3.0,good company to new IC and managers,smart and nice people as colleagues a lot of the timegrowing very fast. especially tiktok part,a lot of restructuring -- sometimes just too messylack of room for IC to growdocumentation and infra are not the best,"Verified User Current Employee  Q*****  Software Engineer - Apr 13, 2021",
4.0,WLB is serious concern,"Career and technical capability development is awesome. Truly top performers all around you, better average employee skills than many big techs.",WLB and compensation is serious concern especially during COVID times.,"Verified User Current Employee  F*********  Software Engineer - Apr 13, 2021",
4.0,Fast Paced Startup is a crutch phrase ,AutonomyFreedom to take on interesting and large projects Learning opportunities ,Lack of transparency Lack of vision on teamInternal politics ,"Verified User Current Employee  P*****  Business Development - Apr 12, 2021",
3.0,Mixed bag experience,"- good amount to learn if working on interesting product area- interesting time to be at company during high period of growth- some good exposures, opportunity to impact decisions or projects","- poor leadership based in Beijing who are inexperienced and highly political- shady political practices, unclear R&R, competitive culture, Beijing leadership unclear about comp and career development - work life balance sucks, late night meetings, burn out happens","Verified User Current Employee  m*******  Sales Strategy Associate - Apr 12, 2021",
3.0,OK,RSU is potentially valuable. There are a lot of swags. ,Culture is terrible. WLB is bad. management is not good,"Verified User Current Employee  m******  Software Back End Engineer - Apr 10, 2021",
4.0,No work life balance ,-Opportunity to learn new skills-Awesome coworkers -4 floating holidays ,Because the company is growing fast you can learn many skills. It's a very plug and play environment. The con is you should expect no additional compensation or acknowledgment.  You can be a 1 person team doing the work if 5 others and will not even get a thank you!,"Verified User Current Employee  k*****  Policy Manager - Apr 8, 2021",
3.0,No WLB,Lots of opportunities for big scope and to solve big problems,"Because of the high growth, the WLB here is not ideal.","Verified User Current Employee  s*****  Program Manager - Apr 8, 2021",
4.0,ByteDance ,"Cutting edge technology, good for career growth. Less politics and heavy on engineering",Wlb. A little chaotic work flow. Internal tools and infrastructure,"Verified User Current Employee  Q*****  Software Engineer I - Apr 6, 2021",
5.0,TikTok is here to make some noise,Company has an amazing trajectory and is able to attract top talent. Fun to be a part of this rocketship,Top talent means that the environment is very competitive and you are expected to carry your own weight ,"Verified User Current Employee  m*****  Data Scientist, Analytics - Apr 5, 2021",
4.0,"Great for career growth, but expect to put in the hours. Everything else is not bad","The company is growing tremendous, so the good side is your hard work will be rewarded. Less politics than other big tech as of now. It's a good place to build up your career, and build some cool shit. ","As everyone has said, working hours are longer but that also depends on teams. I actually find it even long hours but you have full flexibility to control your time, so overall not that bad. Getting around internally, it's still quite messy with structures which takes some time to build. I actually prefer it than big tech which process is too long to get things done. ","Verified User Current Employee  r*********  Partnership Manager - Apr 4, 2021",
4.0,"Money is great, management is not",- great base and usually bonus- they really do try- Bytedance (parent) has a ton of potential ,- rapid growth leads to tons of redundancy between roles and poor direction- if you report into China your WLB is fucked- Toxic executive politics (but getting better),"Verified User Former Employee  p*********  Senior Director, Content Management - Apr 2, 2021",I had two roles at Bytedance and the second role seemed great but was basically an executive trying to land grab.  Didn't work out well for them; they lost.  Direct Manager had zero management experience and very little work experience for team they were managing.  As an early employee I left when I felt I was well vested.  Work there for the comp and the resume boost but I'd be leery looking for any career development.  
3.0,Do your time and bounce,Lot of projects to pick up and work on so helps with your portfolio,Secretive coworkers. Teams don't want to work together. Too much work and no path to grow at the company either. ,"Verified User Current Employee  T*****  Project Manager (Services Division) - Mar 31, 2021",
3.0,0 WLB during COVID,Care packages and swag sent every once in a while.,Siloed teams and codebase reinventing the same functionality due to no cross-functional trust. ,"Verified User Current Employee  y******  Engineer - Mar 30, 2021",
5.0,growth opportunity,"We are learning & doing new things like college students. We don't emphasize experience but attitude, which brings opportunity for new staffs.",The infrastructure is so poor which means labor work is everywhere,"Verified User Current Employee  y*****  Software Engineer - Mar 29, 2021",
1.0,Not competitive ,People all seem hard working Company in US is growing like crazy,"Everything is run out of BeijingHaven't figured out basic principles like ratings, reviews, levelsNot competitive for most teams","Verified User Current Employee  B*****  Operations Manager - Mar 29, 2021",
2.0,Bad bad culture,Can't argue with your boss. You can only say yes. Very poor WLB.,"Top compensation, only come here for the money. There is nothing else attractive here ","Verified User Current Employee  h*****  Software Engineer - Mar 27, 2021",
3.0,Very poor WLB. Stay or apply if you're in it for the money,- Compensation is good- Perks are good- Shares are going to skyrocket when they IPO,"- Unorganized team- Understaffed team- Terrible WLB. Working until 10 pm is commonplace. Sometimes even midnight- Poor and undisciplined engineering cultureIf you are in tech/software engineering to make money, ByteDance is one of the best places to be. But that is not me.","Verified User Current Employee  N*****  Software Front End Engineer - Mar 26, 2021",
2.0,"WLB is a joke, Transparency next to none",Good learning curve and different things to work on and contribute ,"Read the Summary again and again and again. Forget about WLB, it is really just work work balance. A lot of people are burnt out. So many late meetings with China that you can't ignore. Literally no transparency. Management don't feel like they need to respond to employees questions. Many all-hands meeting has happened where Management completely ignored the challenging yet very fair questions from employees. Go look elsewhere if you can. Come back when they truly believe they are an international company and behave like that, currently just a Chinese company located in the US. ","Verified User Current Employee  q*****  Engineer - Mar 23, 2021",
5.0,Very young and face paced i love it ,Loads opportunities of growth and competitive salary and managements are open,too many processes a little bit all over the place,"Verified User Current Employee  r*****  Program Manager - Mar 23, 2021",
5.0,Dynamic and flexible,"You get to do whatever you are interested in, very dynamic with a lot of freedom.Healthy work life balance.","Language barrier unless you understand Chinese, even for global meetings it can be hard to get your point across.","Verified User Current Employee  s*******  Research Scientist - Mar 22, 2021",
3.0,Poor work-life balance,"good leadership and team, free food, young teams, energetic, promising ","poor work-life balance, big workload, fast pace, aggressive, stressful, no enough experiment ","Verified User Current Employee  f*********  UX Research - Mar 21, 2021",
5.0,Tons of good opportunities,Lots of early stage projects. Tons of opportunities. Talented coworker.,"Document organizations could be better. US team is fairly small, lots of dependencies on China mainland teams.","Verified User Current Employee  n****  Software Engineer - Mar 20, 2021",
3.0,I think its a good place to start for people who want to get into the tech space. Management.. needs to wake up though.,- Good place to start for an IT career because it is relatively new in the space. ,- Management isn't that good.. slows the growth and acceleration process. Very hierarchal. Fake flat hierarchy structure - Learning curve depending on job scope,"Verified User Current Employee  X*****  Ad Operations Analyst - Mar 18, 2021",
1.0,Exhausting,"Exciting product, some really smart people. You can have a really big impact.",No career trajectory Managers who don't care about their peopleFast hiring means wrong people at wrong placesTerrible cultureNo problem solvingRefuses to allow flexible working,"Verified User Current Employee  d********  Brand Marketing - Mar 17, 2021",
4.0,Good growth not so good wlb,"Nice supervisor, good career growth, compensation competitive. Team culture seems pretty good, competent team mates",Not very good wlb. Probably much worse wlb than most other companies,"Verified User Current Employee  r*****  Software Engineer - Mar 15, 2021",
4.0,Poor management and wlb,"Opportunity to stretch and grow, builder mindset, platform is exciting","Work life balance is poor, leadership also needs work for business to be successful","Verified User Current Employee  W*****  Sales & Business Development Manager - Mar 14, 2021",
2.0,Poor everything ,Good opportunities to work with Xfn teams around the world,"Poor management, poor salary, poor personal gain. No clear career path","Verified User Current Employee  P******  Product Manager - Mar 12, 2021",
3.0,Challenging but great experienxe,"Great to get global experience.  China tech sector is truly unique.   A lot of great, young people inspired by success.  ",Lots of redundancy and poorly defined roles.  Boss - Worker culture.  Poor work life balance.  ,"Verified User Former Employee  p*********  Strategy & Business Development - Mar 10, 2021",Terrible boss who has since been put to pasture.   Lots of ambiguity between HQ and US office.  
5.0,Ambitious firm,"Employee Well Being and above average compensation, good growth trajectory","Very messy internally and lack of org structure, unclear career path","Verified User Current Employee  X*****  Program Manager - Mar 9, 2021",
3.0,Fast moving and great place to work across functions and make meaningful impact,Collaborative experimentation culture with substantial and sharp engineering capabilitiesOpportunities for global impact,WLB suffers collaborating across so many time zonesBelow average compensation (no RSU grants for non-eng)Limited opportunities for career development,"Verified User Current Employee  m***  Product Manager - Mar 8, 2021",
3.0,Mix Bag,Growth opportunitiesSmart and collaborative colleaguesNot a cut throat environment ,Unclear compensation progressionToo fast Bi-month cycles Unrealistic expectations that aren't clearly tied to compensation,"Verified User Current Employee  I*****  Client Manager - Mar 6, 2021",
4.0,Great place for growth,Growing fast so you can learn a lot and try lots of new things. ,Very fast so can be tiring at times but that's normal at this stage. ,"Verified User Current Employee  t*****  Manager, Business Development - Mar 5, 2021",
2.0,No WLB at all,Opportunities but pretty bad management skills. Ok compensation. Nice environment.,"Not organized, few good planning, pretty bad management skills and not care about your personal development.","Verified User Current Employee  d*******  Technical Program Manager - Mar 2, 2021",
5.0,Inspiring and Inclusion,- find it a really great workplace to start or restart your career because of the potential of the company and the possibility of personal growth- competitiveness of compensation and benefits - colleagues do care about diversity and inclusion,- complicated internal mechanism and management process - sometimes it's hard to achieve WLB,"Verified User Current Employee  f*******  Human Resources Generalist - Mar 1, 2021",
3.0,ambiguity sums it all up,"many opportunities, more than enough problems to go around. most people are smart and very kind too!","nothing is clear, promo criterion, increment, RSU refresher, scope 3 months later, etc.","Verified User Current Employee  g*********  Product Manager - Feb 28, 2021",
5.0,Growth oriented,- competitive pay- preipo with good business model- lots of opportunities,- work life balance isn't great- ambiguous scope / direction,"Verified User Current Employee  e******  Engineer - Feb 27, 2021",
3.0,Little work life balance ,Lots of food and snacks for both lunch and dinner. ,Work life balance can be improved.Too much meetings in different time zone. ,"Verified User Current Employee  C*****  Android Developer - Feb 27, 2021",
5.0,Great company that cares about DEI,- I work with great people- Love being challenges,- Communication could be better- WLB Should be a focus ,"Verified User Current Employee  v*******  Account Manager - Feb 23, 2021",
5.0,"Great company, feels like I'm on board a rocketship","Exciting job scope, fast growing company, great products, talented co-workers.","There are many things to do because the company is moving so fast and growing so fast, but that is the point sometimes. ","Verified User Current Employee  X********  Operation Analyst - Feb 17, 2021",
3.0,Do it if no better option.,- Smart colleagues- Innovative product- Multicultural environment- Growing business- Interesting problems to solve,- Bad comp- No leadership- Uncertain future of non-China business- Double-triple agenda,"Verified User Current Employee  u*********  Business Development - Feb 15, 2021",
4.0,Know what you want,A lot of challenges. Could be great pros if one want the most growth.,A lot of challenges.Infrastructure is not as good as Google or Facebook.,"Verified User Current Employee  Q*****  Software Engineer - Feb 11, 2021",
4.0,Organized chaos - fun but lot of work,"Awesome company, lot to do, lot of awesome tech and teams","Lot of collaboration with international teams, mean long hours and a lot of docs in chinese","Verified User Current Employee  v******  Engineer - Feb 6, 2021",
2.0,Poor WLB if you're working with Chinese colleagues,"If ByteDance is considered a reputable engineering company in your opinion, then perhaps that's the sole pro. Benefits are somewhat ok: 18 days of annual leave, comprehensive insurance package, and gift packs for every festive occasion. ",Poor WLB; a lot of communication and documentation in Chinese.,"Verified User Current Employee  a*********  Software Engineer - Feb 4, 2021",
4.0,"Great Comp, Bad WLB","Comp is competitive (might not be the case for new grad, but definitely when you go senior)Market evaluation is constantly growing which is a plus.Promotion is fair and quick, at least for tech.Food is also good here.","Sh*t WLB if you stuck in a team with bad management, like Tiktok.","Verified User Current Employee  l********  Senior Software Engineer - Feb 4, 2021",
5.0,Great company and benefits but some tradeoffs to mind,"Very smart, hardworking, and friendly coworkers.  If you're not too careful you'll become one of them!Top shelf comp and humongous IPO to look forward to, morale is highGood tech and scope, you will like be part of a small but rapidly growing team working on something that touches 1 billion users","Hours can vary based on if your team is mostly in BeiJing. Most people start at 10 am there, which is 6 pm Pacific time. Expect meetings from 6-8, and more meetings the more reports you haveWlb is worse than average but everyone knows what they signed up for and what they are working for. Unlike other companies this is due to social pressure and not toxic managers/threat of PIP","Verified User Current Employee  w*********  Software Engineer - Feb 2, 2021",
1.0,Bad for english only speakers ,"The app is cool, everything else about tiktok MTV is not really that nice. People are chill and helpful.Join english only team if you can***","Tries to be global company by forcing US employees to work with beijing employees outside of work hours. Language barrier for english only, need to rely on bilingual coworkers Bad wlb, bad hours. They don't care about the L in wlb. Getting pinged at 3 am for nonurgent issues is common.Never get promoted, low bonuses, refreshers","Verified User Current Employee  P*****  Software Developer - Feb 1, 2021",
4.0,Good,very good work life balance i have no complaints ,opportunities for growth are limited at a company of this size,"Verified User Current Employee  h*****  Software Engineer - Feb 1, 2021",
4.0,"Recently joined, seems good so far ","Have lots of autonomy to suggest new stuffs, colleagues are nice too",Maybe salary isn't that great given that I'm in a technical role...,"Verified User Current Employee  l*****  Data Consultant - Jan 30, 2021",
