Rating,Description,Pros,Cons,Author Info,Resignation Reason
3.0,Chinese 996 WLB,"Pre-IPO, with big upside given that TikTok is the next generation social media platform. Kids even using it to message these days, so even Zuck is starting to sweat.","Chinese culture, many co-workers seem to be working all day and night, weekends too, maybe 60-70 hour workweeks?Management very demanding, new features being pushed out constantly, and if you don't deliver, people WILL notice.Also some of the code is commented in Chinese so you should probably put Google Translate under your skills/techs section of your resume if you wanna join TikTok.","Verified User Current Employee  L******  Software Engineer - Feb 20, 2022",
2.0,Dependencies on China,"Product Innovation, Compensation (Not Liquid), Features can impact billions of users","Dependencies on China, WLB, Hard to learn and grow, Language and Timezone barriers","Verified User Current Employee  s*******  Software Engineer - Feb 18, 2022",
5.0,Overall nice environment ,"Fast environment, nice colleagues that's all I can think of ",Tasks are repetitive and pay structure is not transparent and clear,"Verified User Current Employee  b*****  Quality Analyst - Feb 18, 2022",
3.0,No Life,Brand.Able to learn how to build a top consumer product.Move fast. Many interesting directions and innovations.,"Satellite devision, no good projects with big impact and room for promotionRegular meeting at night if you can speak Chinese.Overprice RSU.QA process sucks.","Verified User Current Employee  f*****  Software Engineer - Feb 18, 2022",
3.0,Large work scope poor engineering practices ,Have opportunities to work on a large scope even as a junior member A lot of greenfield projects so more learning opportunities ,Very bad engineering practices like no unit testing or code review. Speed is more important than qualityPoor wlb Promotion is difficult and the criteria are not clear,"Verified User Current Employee  z****  Software Engineer - Feb 18, 2022",
1.0,Bad management and 996 culture,"Good pantry.Compensation is good, but it becomes bad when divided by working hours per month.Working with smart people.","Manager do not know how to manage people and gives unclear requirements.No WLB at all when work with China team, they expect you 996 as well.","Verified User Current Employee  f*****  Software Engineer - Feb 17, 2022",
4.0,wlb is a struggle,so many amazing projects and career growth. It's amazing on your resume,long hours and pay isn't the best compared to other tech companies,"Verified User Current Employee  P*****  Program Manager - IT - Feb 16, 2022",
2.0,Bad training ,"Good pay, good stipends, opportunity for projects if you're a psycho workaholic ",Terrible training from the start. Crazy deadlines with no assistance ,"Verified User Current Employee  Y*****  Analyst - Business Consulting - Feb 15, 2022",
3.0,Resume builder but that may be it,Honestly this really depends on your region/accounts/manager. I feel like I have found a unicorn in my personal situation as all three for me are amazing. ,Work life balance is bad. Lots of internal meetings /trainings which can leave little time for you to focus on your clients.,"Verified User Current Employee  j*****  Sales Account Executive - Feb 15, 2022",
5.0,"growth fast, good pay","competitive pay,  good benifits, company grows fast, nice and helpful coworkers, good product","mediocre wlb, uncertain ipo plan, late meeting with cn colleagues","Verified User Current Employee  p*****  Data Scientist - Feb 14, 2022",
4.0,"New tech, if you are willing to learn new things, you can obtain much more","New technology, rapid pace. You can learn new things here. ",Need to work with bi-language sometimes. You also need to adjust different WLB.,"Verified User Current Employee  t*****  Software Engineer - Feb 14, 2022",
3.0,Work life balance is up to you ,Salaries and benefits are improving and I think there are good people working here.,There doesn't seem to be a lot of support for work life balance so it's up the individual to ensure that you have it. I don't think that's a good sign at all but its what it is.  ,"Verified User Current Employee  T*****  Product Manager I - Feb 13, 2022",
2.0,Horrible work culture ,Fast company growth so opportunities to move around to other parts of the company ,No WLBBad management Lack of role & responsibilities Lack of transparency ,"Verified User Current Employee  S*****  Product Analyst - Feb 11, 2022",
4.0,great potential with hard working talents,great potential with hard working talentsï¼Œdifferent culture and diversityï¼Œworth trying,above average working hoursyoung managements and unclear boundariestime zone issues,"Verified User Current Employee  e*****  Product Operations Specialist - Feb 11, 2022",
3.0,lots of opportunity,Lots of new opportunities and you end up having a big scope,"poor wlb, working model is inefficient, management team is not strong and accountable ","Verified User Current Employee  k*****  Data Scientist - Feb 11, 2022",
3.0,"Bad work life balance, not competitive pay","Great people at the company, leadership really cares but is strapped by apathetic global lead.","Bad pay, bad work life balance, apathetic global leadership and HR.","Verified User Current Employee  V*****  Client Solutions Lead - Feb 11, 2022",
3.0,Huge trade-off play,"Well-known company for resumeLarge, interesting consumer product that moves quicklyPotential for large impact and scopeSolid comp",Unclear roles and responsibilitiesChinese work culture (internal competition) + hours (bad WLB) + language hurdlesUpward mobility is difficult if not fluent in Mandarin,"Verified User Current Employee  l****  Product Manager/Strategy - Feb 10, 2022",
2.0,No worklife balance or career growth,Recognizable name on resumeLearning new productCoworkers and clients,no work life balanceLack of career growthnew management,"Verified User Current Employee  q*****  Client Solutions Manager - Feb 9, 2022",
4.0,Good for learning but not good for career growth,Lots of exciting projects to work on. Compensation is good when you sign the offer.,Not friendly for growth. Nobody can say clearly what you need to do for promotion. ,"Verified User Current Employee  v*****  Software Engineer - Feb 9, 2022",
5.0,Good place to work,Hopefully IPO  but If not still not a bad base salary,Culture difficult sometimes with colleagues struggle to understand English and things lost in translation ,"Verified User Current Employee  r*****  UX Designer - Feb 9, 2022",
3.0,Bad wlb,"If you know chinese, it's so much easier for you to communicate","If you don't know chinese, it's too hard for you to communicate ","Verified User Current Employee  p*****  Software Engineer - Feb 8, 2022",
3.0,Not a good place to work for non-Chinese speaking senior engineers ,"Very few, and only non work related. Otherwise don't have any pros ","Have to work with engineering and PMs in Beijing team, they only understand mandarin. Language is a great barrier in communication and career growth","Verified User Current Employee  b********  Software Engineer - Feb 8, 2022",
3.0,Good company to work for if you are a recent grad,Salary and benefitsCompany cultureProduct is funBrand recognition ,Horrible work life balanceHighly politicalMudane and repetitive tasks,"Verified User Current Employee  z*****  Brand Specialist - Feb 8, 2022",
3.0,"Great work life balance, but questionable for career growth","amazing work life balance, love the culture and communications, love the amount of work. ","Not clear if stable, don't know what career skills I can achieve. ","Verified User Current Employee  U*****  Safety Specialist - Feb 8, 2022",
3.0,My impression so far,"Caring manager, and people are nice. I will update my rating later if I feel differently ",WLB sometimes takes a toll. Communication  barriers with other teams,"Verified User Current Employee  L*******  Software Engineer - Feb 6, 2022",
4.0,Great pay poor management,"Good pay, top level you can expect, very large scope and impacta","Poor management, late meetings, wlb is not ideal, Chinese heavy","Verified User Former Employee  z*****  Software Engineer - Feb 6, 2022","Poor management, late meetings, wlb is not ideal, Chinese heavy"
3.0,Awful leadership and comp,The people and the product are what makes this company. ,Leadership is terrible particularly one person and compensation is unfair and comical ,"Verified User Former Employee  q*****  Client Solutions Lead - Feb 6, 2022",Leadership and compensation as mentioned above is why I chose to leave . 
3.0,Love my coworkers that is it ,Coworkers are amazing and some of the best people i have met in this industry ,Leadership is a mess and not respected There is no direction or guidance You will hit your commission about half the year Terrible pay ,"Verified User Current Employee  f*****  Sales - Feb 5, 2022",
2.0,BAD WLB and management,* High Compensation ~ FAANG* fast paced projects to work on,* worst WLB i have seen in my career* chinese documentation* chinese speaking meetings* bad management* strict deadlines and they doesn't listen to reasons,"Verified User Current Employee  a*****  Software Engineer - Feb 4, 2022",
3.0,Should be amazing but isn't ,"Great platform, interesting work, fast moving, amazing colleagues.  Tiktok is def having a moment and it's fun to be a part of it.  ","Simply put - this is not a company that cares for or optimizes for people.  Overly bureaucratic.  No cultural EQ. Spend a lot of time on unnecessary, internal fighting and lobbying which will hurt the company when natural growth wanes.  ","Verified User Current Employee  i*****  Sales - Feb 2, 2022",
4.0,"Poor management, Not good for career developement",Not very busy during the day when everyone in US is working remotely and main stakeholders are in China.,"1.Busy in the evening as main stakeholders are in China.2.Didn't see business ownership, decision making and people development in management, individually they have the potential and ability, but putting together no joint force and top down execution.","Verified User Current Employee  F*****  Senior Data Scientist - Feb 2, 2022",
4.0,Great if you can land on the right team,"Team & org dependent, big impact at scale, more global than FAANG","wlb, compensation, slow to change, internal cultural differences b/w old and new employees","Verified User Current Employee  Y*****  Mobile Engineer - Feb 2, 2022",
2.0,Caring for their people is not a priority,You get to work on projects that you normally wouldn't be able to touch at other companies with very little experience.,"All direction and decision making comes from China leadership which does not seem to highly value their employees. Decisions about promoting and pay are made subjectivly with little to no transparency. If you are looking for career growth and are not a native mandarin speaker, look elsewhere. ","Verified User Current Employee  m********  HR Clerk - Feb 1, 2022",
3.0,"Great work life balance, lots of trust ","On my team at least, we have a lot of flexibility and trust to do our job at whatever time works for us. We work globally so being able to be flexible as a company and as an employee is important. growth options are there after a few years. great intro to tech! ","Salaries are just ok, I'm learning other companies are more competitive ","Verified User Current Employee  w*****  People Operations Specialist - Feb 1, 2022",
3.0,Unwelcome environment for non-Chinese speakers,- Great company for ML engineers- Working on a product that almost everyone uses now,"- If you don't speak Chinese, you will have a tough time- Internal tools are terrible- No meaningful pay bump from promotion","Verified User Current Employee  d********  Software Engineer - Feb 1, 2022",
1.0,Worst place I have worked at,- There are few good folks who see this problem and are tryin to help but unfortunately have little resource to make a change- Mental health support and free counseling session under EAP,"- Lack of diversity in Management - Gaslighting. It is much more common than you might think, specially from your Chinese managers and counterparts - Constant pressure to deliver, you are a robot who is sprinting all the time - Lot of negativity and even if you try to keep personal life separate from work, at the end of the day you will be so exhausted that it will impact your personal life- In performance review you are only rewarded with higher ratings if you exceed expectation and even if you work round the clock thats meeting expectation as per your managers in China. If you try to balance and take control of your own WLB then managers dont shy from giving you negative rating in performance and no bonus.- Promotions are rarest event","Verified User Current Employee  V******  Product Manager - Jan 31, 2022",
4.0,Poor work life balance,Good opportunity to be promoted into the job and change roles internally,Too much to do. We don't hire enough people to have good wLB,"Verified User Current Employee  Y*****  Senior Manager, Operations - Jan 31, 2022",
1.0,"If you are a Product Manager, do yourself a favor and don't join Bytedance / Tiktok ","Compensation might be as per industry standard, good swags and benefits ","Bad mangers, no cultural diversity in managers, career growth, no promotions, unfair performance review system, constant pressure to launch, no structure, personal comments or feedback from Chinese management, gaslighting, manipulation as words of management don't match actions. Bad for mental health and extremely hard environment for new parents. ","Verified User Current Employee  $******  Product Manager - Jan 31, 2022",
2.0,Hard to imagine staying long-term,Base salary and bonus is pretty competitive. Big name to put on a resume. ,"Flat org structure. This is advertised toemployees as some sort of way to make peoplefeel empowered, but really it just puts you at adisadvantage to have meaningful time with yourmanager if you're a part of a large team.Position leveling is extremely ambiguous. No clear direction for promotions. ","Verified User Current Employee  C*****  Infrastructure Engineer - Jan 29, 2022",
2.0,Exciting. No WLB. Poor Mgmt ,"You'd get lots of responsibility with no recognition. If you're in product or enf, you don't need Chinese but will feel alienated. Expect to work until 10pm PST because of Asia colleagues. ","Wlb, culture sucksNo transparencyMediocre benefits, stingyBurned out colleagues","Verified User Current Employee  f*********  Product Manager - Jan 27, 2022",
4.0,"wlb sucks , base salary is good",base salary is goodColleagues are highly skilled no more,wlb suckshigh peer presure very short OKR period  to update,"Verified User Current Employee  s*********  Senior Site Reliability Engineer - Jan 27, 2022",
4.0,Allows for autonomy and accountability of owned projects. Some things have bureaucracy while others don't.,So far have enjoyed my experience. Nascent company with teething problems. ,Work life balance isn't great. Difficult to build culture when the entire org almost was hired while WFH,"Verified User Current Employee  k*****  Content Director - Jan 26, 2022",
5.0,"Great work life balance, compensation, additional perks and benefits.","Team and organization values your work and commitment and motivates you to raise the bar.Excellent compensation, additional perks and bonuses.",Lack of team building sessions and hard to get updates regarding company's growth and next move. ,"Verified User Current Employee  M******  Risk Management Analyst II - Jan 26, 2022",
4.0,Challenging but rewarding work,Pay is great;Work is challenging but rewarding Fast career growth Large scope and impact ,"Long hours, need to work nights and sometimes weekends Demanding management team Unclear IPO  ","Verified User Current Employee  O*****  Product Manager - Jan 26, 2022",
3.0,I've been with TikTok for the past 6 months & I've been enjoying my time here.,-Limitless opportunities-Peer collaboration-Impressive comp ranges-Flexibility-Sufficient Mentorship,"-Still a start up, so we're experiencing growing pains","Verified User Current Employee  s*****  Talent Acquisition - Jan 25, 2022",
3.0,Chaotic work environment ,Company looks great on a resumeDecent swag dropsGreat coworkers,"China owned, mainland CN is where all of the decisions are madeNo transparencyNon-competitive payVery few people have a balanced WLB here","Verified User Current Employee  P*****  Data Analyst II - Jan 25, 2022",
4.0,Great growth,"Over all Company Move fast, team has many challenging tasks","Like to Break things, not new grad friendly, low doc","Verified User Current Employee  w*****  Software Applications Engineer - Jan 25, 2022",
3.0,"Fast growth, no wlb","Learn from others, many highly experienced people from FAANG companies.","Overlapping job scope and responsibilities, a lot of meetings to coordinate and deconflict.","Verified User Current Employee  Y*****  Product Manager - Jan 24, 2022",
5.0,Great time to join,-Tremendous learning experience-Ability to make an impact-Good timing to join-Moving very quickly so constantly iterating,-Work life balance is tough-Company growing faster than headcount,"Verified User Current Employee  T*****  Sales - Jan 24, 2022",
4.0,Challenging work but good experience ,The work is interesting and challenging. Gaining valuable experience to further career,Compensation is lower compared to other companies. Work load is high,"Verified User Current Employee  Y*****  Talent Acquisition Partner - Jan 22, 2022",
4.0,Decent (my experience not as bad as what others say),"- In my team in Singapore: No Chinese speaking- Good core engineering team, practices- Very good internal tools- Great manager (for me), good and interesting work. - Very fast learning pace and opportunities. I believe you will learn 3-5x faster than people of other firms- Decent Compensation- Decent WLB in SG (40hrs work week, though sometimes I need to pull 50-60)",- Promotion Cycles seem slower- Expanding very fast - company has not slowed down to reward the current employees who helped it come this far- Shady HR practices (saying they don't give sign on bonus but actually they do give to another person),"Verified User Current Employee  V*****  Software Engineer - Jan 21, 2022",
1.0,Low Retention on Talent,Amazing product and loved most of the people that I worked with.,"Demanding work culture, low pay, no work life balance, confusion on processes, lack of direction with leadership, little recognition. ","Verified User Former Employee  A*****  Sales - Jan 21, 2022",Same as all the cons I listed. This company does not know how to retain talent. 
3.0,"Good Compensation, dysfunctional company",Good compensationIncredible talentFun projects depending on the team,Little career growthConfusing org structureNo access to management,"Verified User Current Employee  t*******  Software Engineer - Jan 20, 2022",
3.0,It's okay,"Good product, rocketship, plenty of opportunities, strong tail winds for product",Lots of Late night meetings; weak leadership; goals are very aggressive ,"Verified User Current Employee  E*********  Software Applications Engineer IV - Jan 19, 2022",
4.0,Okay,"- Good employee perks (free meals, gym reimbursement, phone bill reimbursement)- good pay",- Poor Wlb- it will be easier for employee to understand Chinese to survive in this company,"Verified User Current Employee  s******  Operation Analyst - Jan 18, 2022",
4.0,Decent opportunity ,You can progress in the company and there is a lot of opportunity now. ,But comp structure is not the best at the moment. ,"Verified User Current Employee  r******  Sales - Jan 18, 2022",
4.0,Growing fast; Career growth is available if you seek it out,"-Lots of opportunities if you actively seek them out, supportive leadership; great morale, good communication",-can lack work-life balance; benefits do not compare to FAANG,"Verified User Current Employee  T*********  Ad Operations Specialist - Jan 17, 2022",
2.0,"Great products, Highly Dysfunctional","- Depending on your role, team, and region your experience will be very different. I've enjoyed working with my team. - Tons of great career opportunities, ability to take on large scale global projects.- No titles which allows for more collaboration. ","- The worst WLB in my career- Losing a lot of great talent- All decisions have to go through China, which prevents work from getting done.- Never hear from ByteDance leadership- Slow to make any internal changes to better the culture, employee experience- Dysfunctional with no company strategy","Verified User Current Employee  B*********  HR Team Member - Jan 17, 2022",
1.0,Nothing positive but the comp.,"- Company is a rocketship, and will grow and dominate a lot of markets.- TC was competitive, solid cash component- Projects are well funded, and headcount is easily available for important divisions.","- Culture is adversarial, don't see a lot of collaborative work.- Management is overextended, not very organized.- Lot of reliance on China teams for direction, often clash in cultures.- A disadvantage for non-mandarin speakers.- WLB is terrible. It's called out as a top priority constantly, but don't really see any progress.","Verified User Current Employee  t*******  Data Scientist - Jan 16, 2022",
2.0,"Toxic culture, long working hour, immature management, poor product operation.","If you are a researcher in recommendation system, it might be okay for you.",Hardly sperated with its China centric operation and culture. Insane working hourPoor management,"Verified User Former Employee  W*****  IT Manager/Tech Lead - Jan 15, 2022","WLB is horrible, any position that needs to deal with product owner in China is not recommended."
2.0,Ads Policy - Monetization Interigty,-fast pace and plenty of policies to create-great regional leader-down to earth teammates ,"-majority of the week consist of escalations by XFNs-constant one off messages from Sales requesting exceptions-weekly assignments from HQ with no prior warning, and little to no background context -global leader lacks vision and follow through -policy team falls under the Sales umbrella which means exceptions will likely occur if AMs and BPMs escalate high enough -zero room for growth-wlb is mediocre -pay is extremely below market rate ","Verified User Current Employee  k*****  Policy Manager - Jan 14, 2022",
4.0,"Great work life balance, compensation is okay, management growing","Hyper growth makes work really exciting and funPre-IPO means a lot of potential in stock TikTok surpassed Google in amount of time spentTikTok is already dominating the tech space and we have so much more projects to grow, this is only the startA lot of work life balance on my end. Can enjoy life outside of work without having any stress",- Growing management means there are some spaces where employees don't have a manager and are led by someone above their manager until the manager position is filledLeadership is still being filled but it's okay because we are growing faster than we can keep up with,"Verified User Current Employee  r********  Technical Recruiter - Jan 14, 2022",
5.0,Perfectly okay,Good working culture.No extended working hours.Good benefits and compensation.,Nil so far - as I'm still new to the company,"Verified User Current Employee  k*********  Quality Analyst - Jan 14, 2022",
5.0,Great team ,"Flexible and I build what I see is needed. I work on a product umbrella, but am trusted to recommend what I see is most necessary. ",Can be boring and global staff can have weird hours,"Verified User Current Employee  j*****  R&D Team Lead - Jan 13, 2022",
5.0,Big scope,"Big scope and quick growth,can find your right place here",Document is not good and wlb need to be improved,"Verified User Current Employee  g******  Software Engineer - Jan 13, 2022",
2.0,not a good place for career grow,"Large scope, could take a lot responsibility very easily if you want ","Very bad wlb, need to work with overseas teams, late night meetings and under staffed team ","Verified User Current Employee  w*****  Software Engineer - Jan 12, 2022",
5.0,Fantastic colleagues,"Smart, driven coworkersLeaders that care about your development Custom built internal systems that run pretty efficientlyPay and benefits are competitive","Lots of Ambiguity Leadership not being on the same page Redundancies across the org - people doing the same thing as other teamsInternal policies that may conflict with each otherWorking with Asia team although not ideal has been manageable, only have have to do evening calls 1x a week.","Verified User Current Employee  m*****  Talent Acquisition - Jan 12, 2022",
2.0,Good place to learn a lot but not a place for long term Career growth,-Depends on team but good and talented coworkers- ability to transfer teams,- lots of turnover- once you come in don't expect any significant raise even after promotion- wlb can be bad ,"Verified User Former Employee  F*****  Risk Analyst - Jan 11, 2022",Compensation and wlb after promotion were not worth it anymore 
3.0,Communication Needs Work,Since it is a start up there is a lot of room to grow into a different role and create your own career path.  Allow you to take your own direction on how you work - as long as you find success nothing will be said about how you get things done.,Communication from upper management is AWFUL. Will take days to get back to you after following up 3+ times.  Slows down the process for everything since they are the ones that need to sign off for processes to move forward.  Really do not understand why this is such a big issue that is just looked past and not addressed.,"Verified User Current Employee  w*********  Talent Acquisition - Jan 10, 2022",
